{
  "id": "urn:oids:taxonomy:facade-envelope:0.1.0",
  "title": "Facade and Building Envelope Recommended Terms",
  "version": "0.1.0",
  "status": "draft",
  "terms": [
    {
      "standardId": "urn:oids:term:inspection:facade-envelope",
      "code": "facade-envelope",
      "label": "Facade and building envelope inspection"
    },
    {
      "standardId": "urn:oids:term:asset:building",
      "code": "building",
      "label": "Building"
    },
    {
      "standardId": "urn:oids:term:observation:visible-condition",
      "code": "visible-condition",
      "label": "Visible condition"
    },
    {
      "standardId": "urn:oids:term:finding:masonry-cracking",
      "code": "masonry-cracking",
      "label": "Masonry cracking",
      "aliases": [
        "brick cracking",
        "step cracking"
      ]
    },
    {
      "standardId": "urn:oids:term:component:exterior-wall",
      "code": "exterior-wall",
      "label": "Exterior wall"
    },
    {
      "standardId": "urn:oids:term:material:brick-masonry",
      "code": "brick-masonry",
      "label": "Brick masonry"
    },
    {
      "standardId": "urn:oids:term:issue:professional-review",
      "code": "professional-review",
      "label": "Professional review required"
    },
    {
      "standardId": "urn:oids:term:rating:low",
      "code": "low",
      "label": "Low"
    },
    {
      "standardId": "urn:oids:term:rating:moderate",
      "code": "moderate",
      "label": "Moderate"
    },
    {
      "standardId": "urn:oids:term:rating:high",
      "code": "high",
      "label": "High"
    }
  ]
}
